{
  "schemaVersion": "source_lead_batch_v2",
  "leadBatchId": "source-leads-tnm-manual-20260812141945",
  "runId": "tnm-manual-20260812141945",
  "createdAt": "2026-08-12T14:20:18.000Z",
  "scope": {
    "description": "One dedicated CENGN correct-kind dossier resolving its federal not-for-profit identity, cluster-operator mandate, cloud/network test capabilities, ENGINE funding, current partners, access route and unresolved security/outcome boundaries.",
    "targetMissionAreaSlugs": [
      "edge-data-processing"
    ],
    "targetTechnicalDomainSlugs": [
      "communications-and-cyber",
      "mission-software-and-data"
    ],
    "targetOrganizationKinds": [
      "ecosystem_organization"
    ],
    "targetDemandIssuerTypes": []
  },
  "leads": [
    {
      "leadType": "organization_lead",
      "id": "lead-cengn-12141945",
      "source": {
        "id": "source-cengn-corporations-canada",
        "title": "Federal corporation information - 901338-5",
        "url": "https://ised-isde.canada.ca/cc/lgcy/fdrlCrpDtls.html?corpId=9013385",
        "publisher": "Corporations Canada",
        "sourceKind": "government_service_page",
        "publishedAt": null,
        "accessedAt": "2026-08-12T14:20:18.000Z",
        "locator": "Current corporation details, registered office, legal status, governing statute and annual-return history",
        "summary": "The federal record identifies the exact legal name CENGN - Centre of Excellence in Next Generation Networks, corporation 901338-5, business number 834566986RC0001, active soliciting status under the Canada Not-for-profit Corporations Act from 2014-09-09, and the Ottawa registered office at 340 Albert Street, suite 1400."
      },
      "discoveryPath": [
        "https://ised-isde.canada.ca/cc/lgcy/fdrlCrpDtls.html?corpId=9013385",
        "https://search.open.canada.ca/grants/record/ic%2C033-2024-2025-Q2-514907%2Ccurrent",
        "https://www.canada.ca/en/innovation-science-economic-development/news/2024/12/federal-government-strengthens-canadas-telecommunications-ecosystem.html",
        "https://www.cengn.ca/performance-testing-services/",
        "https://www.cengn.ca/services/commercialization-services/cengn-project-areas/network-applications/",
        "https://www.cengn.ca/living-lab-initiative/",
        "https://www.cengn.ca/contact-us/",
        "https://www.ericsson.com/en/blog/north-america/2026/ericsson-canada-opens-advanced-private-5g-manufacturing-lab-in-quebec",
        "https://uwaterloo.ca/robohub/news/cengn-announces-living-lab-partnership-waterloo-robohub-and"
      ],
      "possibleMissionAreaSlugs": [
        "edge-data-processing"
      ],
      "possibleTechnicalDomainSlugs": [
        "communications-and-cyber",
        "mission-software-and-data"
      ],
      "sourceConfidence": "high",
      "alignmentConfidence": "moderate",
      "evidenceLocator": "Exact federal identity, current technical services, ENGINE agreement and independently controlled Ericsson and Waterloo partner records",
      "duplicateFingerprint": {
        "canonicalUrl": "https://www.cengn.ca/",
        "websiteDomain": "cengn.ca",
        "stableSlug": "cengn",
        "legalName": "CENGN - Centre of Excellence in Next Generation Networks",
        "aliases": [
          "Centre of Excellence in Next Generation Networks"
        ]
      },
      "followUpQuestions": [
        "Which security classification, data-handling and recognized certification boundary applies to the selected CENGN test environment?",
        "What price, queue, test capacity, service level and funding match applies to a specific eligible applicant and configuration?",
        "Which performance-test or living-lab stream can reproduce the intended operational network, robotics or advanced-manufacturing environment?"
      ],
      "discoveryLane": "corporate_registry",
      "inclusionScore": 94,
      "completenessScore": 92,
      "reviewWarnings": [
        "CENGN is a federally incorporated soliciting not-for-profit and program/testbed operator, not an equity-owned vendor. The $45 million is a non-repayable federal contribution for ENGINE, not ownership or a guaranteed downstream award. Public sources do not establish defence procurement, classified handling authority, recognized security certification, service capacity, pricing, queue, SLA or independently accepted participant performance."
      ],
      "recoveryAttempts": [
        {
          "lane": "official_directory",
          "url": "https://www.cengn.ca/",
          "outcome": "The official surface establishes CENGN's current testbed and commercialization-operator role and routes applicants to services and living labs."
        },
        {
          "lane": "corporate_registry",
          "url": "https://ised-isde.canada.ca/cc/lgcy/fdrlCrpDtls.html?corpId=9013385",
          "outcome": "Corporations Canada resolves the active federal soliciting not-for-profit identity, exact legal name, governing statute and Ottawa registered office."
        },
        {
          "lane": "government_program",
          "url": "https://search.open.canada.ca/grants/record/ic%2C033-2024-2025-Q2-514907%2Ccurrent",
          "outcome": "The federal record resolves the $45 million non-repayable ENGINE contribution, recipient, lifecycle and non-equity funding boundary."
        },
        {
          "lane": "technical_documentation",
          "url": "https://www.cengn.ca/performance-testing-services/",
          "outcome": "CENGN's current service page resolves concrete performance-test functions, infrastructure types, application and availability claims."
        },
        {
          "lane": "customer_partner",
          "url": "https://www.ericsson.com/en/blog/north-america/2026/ericsson-canada-opens-advanced-private-5g-manufacturing-lab-in-quebec",
          "outcome": "Ericsson's partner account adds a dated 2026 manufacturing-lab launch and bounds Ericsson, CNIMI and CENGN roles."
        },
        {
          "lane": "procurement",
          "url": "https://canadabuys.canada.ca/en",
          "outcome": "Official pages repeated secure and isolated infrastructure claims, while unrelated defence labs and a job description surfaced. No durable CENGN defence contract, classified-handling authority, Controlled Goods status, ISO 27001, SOC 2, Protected B or other recognized accreditation was found."
        },
        {
          "lane": "bilingual_web",
          "url": "https://www.cengn.ca/fr/services-de-tests-de-performance/",
          "outcome": "The French official surface corroborates the same CENGN performance-testing mandate and adds no material identity, ownership or capability contradiction."
        }
      ],
      "disposition": "qualified",
      "doNotIngestReason": null,
      "organizationName": "CENGN",
      "proposedKind": "ecosystem_organization",
      "proposedCategories": [
        "cluster_operator"
      ],
      "websiteUrl": "https://www.cengn.ca/",
      "aliases": [
        "Centre of Excellence in Next Generation Networks"
      ],
      "location": {
        "city": "Ottawa",
        "provinceTerritory": "Ontario",
        "countryCode": "CA"
      },
      "candidateCapabilityName": "Cloud and application performance validation",
      "roleSpecificEvidence": "Corporations Canada and ISED resolve CENGN as an active federal not-for-profit and ENGINE lead; current CENGN, Ericsson and Waterloo sources support concrete cloud, network and living-lab validation roles without inferring ownership, procurement, accreditation or participant outcomes."
    }
  ]
}
