{
  "schemaVersion": "source_lead_batch_v2",
  "leadBatchId": "tnm-manual-20260720210514",
  "runId": "tnm-manual-20260720210514",
  "createdAt": "2026-07-20T21:06:00.000Z",
  "scope": {
    "description": "User-directed Canada-first deep research on Dominion Dynamics, covering its Arctic autonomy, sensing, command-and-control, aerospace, sovereign simulation, procurement-intelligence, field-deployment, partnership, and Canadian operating evidence.",
    "targetMissionAreaSlugs": [
      "arctic-domain-awareness",
      "autonomous-patrol-and-monitoring",
      "edge-data-processing"
    ],
    "targetTechnicalDomainSlugs": [
      "sensing-and-isr",
      "autonomous-systems",
      "mission-software-and-data",
      "space-and-earth-observation",
      "aerospace-and-mobility",
      "communications-and-cyber",
      "test-training-and-sustainment",
      "advanced-manufacturing-and-integration"
    ],
    "targetOrganizationKinds": [
      "company"
    ],
    "targetDemandIssuerTypes": []
  },
  "leads": [
    {
      "leadType": "organization_lead",
      "id": "lead-dominion-dynamics",
      "source": {
        "id": "source-dominion-official-platforms",
        "title": "Building Next-Generation Defence Systems",
        "url": "https://www.ddc2.com/",
        "publisher": "Dominion Dynamics",
        "sourceKind": "official_organization_profile",
        "publishedAt": null,
        "accessedAt": "2026-07-20T21:06:00.000Z",
        "locator": "Mission, Platforms, AI Native, Interoperable, Modular, AuraNet, Contact, and Join our team sections",
        "summary": "Dominion's canonical site describes a Canadian defence-technology portfolio spanning integrated autonomy, sensing, communications, command and control, edge data fusion, modular integration, and the AuraNet platform for extreme and infrastructure-constrained operations."
      },
      "discoveryPath": [
        "https://www.ddc2.com/",
        "https://www.ddc2.com/news",
        "https://www.ddc2.com/news/auranet-high-arctic-nanook",
        "https://www.ddc2.com/aurion",
        "https://aurion.ddc2.com/",
        "https://www.newswire.ca/news-releases/dominion-dynamics-raises-139m-cad-series-a-to-scale-arctic-surveillance-network-and-drone-systems-859179965.html",
        "https://www.newswire.ca/news-releases/dominion-dynamics-makes-initial-50-million-investment-to-build-a-sovereign-autonomous-wingman-892420247.html",
        "https://www.newswire.ca/news-releases/dominion-dynamics-and-denvr-partner-to-build-canada-s-first-sovereign-ai-simulation-environment-for-autonomous-collaborative-platforms-882365877.html",
        "https://www.newswire.ca/news-releases/dominion-dynamics-launches-aurion-an-open-source-procurement-intelligence-platform-for-canada-s-defence-industry-813266542.html",
        "https://international.canada.ca/en/global-affairs/campaigns/advisory-committee/eliot-pence"
      ],
      "possibleMissionAreaSlugs": [
        "arctic-domain-awareness",
        "autonomous-patrol-and-monitoring",
        "edge-data-processing"
      ],
      "possibleTechnicalDomainSlugs": [
        "sensing-and-isr",
        "autonomous-systems",
        "mission-software-and-data",
        "space-and-earth-observation",
        "aerospace-and-mobility",
        "communications-and-cyber",
        "test-training-and-sustainment",
        "advanced-manufacturing-and-integration"
      ],
      "sourceConfidence": "high",
      "alignmentConfidence": "moderate",
      "evidenceLocator": "Canonical platform pages, official company newsroom, company-issued releases, live AURION service, and current Government of Canada founder profile",
      "duplicateFingerprint": {
        "canonicalUrl": "https://www.ddc2.com/",
        "websiteDomain": "ddc2.com",
        "stableSlug": "dominion-dynamics",
        "legalName": null,
        "aliases": [
          "Dominion",
          "Defend the Dominion"
        ]
      },
      "followUpQuestions": [
        "Should reviewers retain AURION inside the same defence-prime profile or treat it as an adjacent ecosystem-intelligence product?",
        "Should the Scout Autonomous Collaborative Platform remain a program-level capability until product specifications become more public?",
        "How prominently should company-reported Operation NANOOK-NUNALIVUT field activity appear when no matching government deployment source was located in this run?",
        "Should a future review add an exact Kanata facility address if a canonical company contact or facility page publishes it?"
      ],
      "disposition": "qualified",
      "doNotIngestReason": null,
      "organizationName": "Dominion Dynamics",
      "proposedKind": "company",
      "proposedCategories": [
        "commercial_company",
        "defence_supplier",
        "dual_use"
      ],
      "websiteUrl": "https://www.ddc2.com/",
      "aliases": [
        "Dominion",
        "Defend the Dominion"
      ],
      "location": {
        "city": "Ottawa",
        "provinceTerritory": "Ontario",
        "countryCode": "CA"
      },
      "candidateCapabilityName": "Dominion integrated Arctic autonomy and command portfolio",
      "roleSpecificEvidence": "Complementary official sources identify Dominion Dynamics as an Ottawa-headquartered Canadian defence-technology company developing AuraNet data fusion and command-and-control software, Arctic sensing and communications integration, the Scout autonomous collaborative aircraft program, a sovereign AI simulation environment with Denvr, and AURION procurement intelligence. Company reports also document Canadian Rangers field activity and a new Kanata manufacturing facility."
    }
  ]
}
