{
  "schemaVersion": "source_lead_batch_v2",
  "leadBatchId": "tnm-manual-20260720201335",
  "runId": "tnm-manual-20260720201335",
  "createdAt": "2026-07-20T20:15:10.000Z",
  "scope": {
    "description": "Canada-first gap-targeted demand research for a durable federal-government program with concrete Arctic operational outcomes, committed investment, implementation locations, and current official evidence.",
    "targetMissionAreaSlugs": [
      "arctic-domain-awareness"
    ],
    "targetTechnicalDomainSlugs": [
      "aerospace-and-mobility",
      "test-training-and-sustainment",
      "advanced-manufacturing-and-integration",
      "communications-and-cyber",
      "space-and-earth-observation"
    ],
    "targetOrganizationKinds": [],
    "targetDemandIssuerTypes": [
      "federal_government",
      "department",
      "armed_forces"
    ]
  },
  "leads": [
    {
      "leadType": "demand_signal_lead",
      "id": "lead-canada-northern-operational-support-hubs",
      "source": {
        "id": "source-northern-operational-support-hubs-program",
        "title": "Northern Operational Support Hubs (NOSH)",
        "url": "https://www.canada.ca/en/department-national-defence/services/northern-operational-support-hubs.html",
        "publisher": "National Defence",
        "sourceKind": "government_service_page",
        "publishedAt": "2026-03-13T00:00:00.000Z",
        "accessedAt": "2026-07-20T20:15:10.000Z",
        "locator": "Vision, Hubs and nodes, Site locations, Arctic and northern investment, Engagement and consultation, and Contact us sections",
        "summary": "The current official program page documents a $2.67 billion, 2024-2044 network of Arctic hubs and nodes intended to improve Canadian Armed Forces presence, reach, mobility, responsiveness, logistical support, and year-round operations."
      },
      "discoveryPath": [
        "https://www.canada.ca/en/department-national-defence/corporate/reports-publications/north-strong-free-2024.html",
        "https://www.canada.ca/en/department-national-defence/services/northern-operational-support-hubs.html",
        "https://www.canada.ca/en/department-national-defence/news/2025/03/minister-blair-announces-first-northern-operational-support-hub-locations.html",
        "https://www.canada.ca/en/department-national-defence/corporate/reports-publications/industrial-strategy/security-sovereignty-prosperity.html"
      ],
      "possibleMissionAreaSlugs": [
        "arctic-domain-awareness"
      ],
      "possibleTechnicalDomainSlugs": [
        "aerospace-and-mobility",
        "test-training-and-sustainment",
        "advanced-manufacturing-and-integration",
        "communications-and-cyber",
        "space-and-earth-observation"
      ],
      "sourceConfidence": "high",
      "alignmentConfidence": "moderate",
      "evidenceLocator": "Program vision, infrastructure and logistics model, confirmed locations, public investment, partner commitments, and intended operational outcomes",
      "duplicateFingerprint": {
        "canonicalUrl": "https://www.canada.ca/en/department-national-defence/services/northern-operational-support-hubs.html",
        "websiteDomain": "canada.ca",
        "stableSlug": "canada-northern-operational-support-hubs",
        "legalName": null,
        "aliases": [
          "Northern Operational Support Hubs",
          "NOSH",
          "Northern Operational Support Nodes",
          "NOSN"
        ]
      },
      "followUpQuestions": [
        "Should the reviewer expose the hub and node locations in the public summary or retain them as evidence detail?",
        "Should future procurement notices and individual site projects become separate demand sources when their scopes and delivery authorities are public?",
        "Does the derived Arctic Domain Awareness mapping adequately describe the program's enabling role without overstating it as a sensing requirement?"
      ],
      "disposition": "qualified",
      "doNotIngestReason": null,
      "title": "Northern Operational Support Hubs: Arctic operational reach and sustainment",
      "issuerNames": [
        "Government of Canada",
        "Department of National Defence",
        "Canadian Armed Forces"
      ],
      "demandSourceKind": "capability_plan",
      "commitmentLevel": "programmatic",
      "candidateRequirements": [
        "Canada requires a distributed network of northern hubs, nodes, transportation corridors, infrastructure, logistics, pre-positioned resources, and quickly activated multi-modal support so the Canadian Armed Forces can respond faster, remain longer, and operate effectively year-round across the Arctic.",
        "Northern operational infrastructure should support military requirements while enabling collaboration with Indigenous, territorial, provincial, municipal, federal, industry, academic, and allied partners and providing durable dual-use community benefits where feasible."
      ]
    }
  ]
}
